{
  "agent": "pm03-reviewer",
  "artifacts": [],
  "authorization": "",
  "blockers": [],
  "created_at": "2026-10-28T02:38:21+00:00",
  "ended_at": "2026-10-28T02:38:30+00:00",
  "evidence": [],
  "git": {
    "base_sha": "6c2091425e7d11c558274add613aa9b5b3b9c7e8",
    "branch": "master",
    "head_sha": "14cc8fcba367dc36db0706041a21f22e10e3264e"
  },
  "goal_id": "G-B0-REVIEW",
  "handoff": ".project-memory/handoffs/B0/run-review-20261028T103443.json",
  "kind": "agent_run",
  "model": {
    "id": "pm03-reviewer",
    "provider": "qoder"
  },
  "revision": 2,
  "role": "verifier",
  "run_id": "run-review-20261028T103443",
  "schema_version": "1.2",
  "session_id": "pm03-pilot-03-20261028T103443",
  "started_at": "2026-10-28T02:38:21+00:00",
  "status": "submitted",
  "task": "B0",
  "tool": "",
  "updated_at": "2026-10-28T02:38:30+00:00"
}
